{
  "segmen": "Motor",
  "periode": "Q1 2026",
  "judul_utama": "Monitoring performa dan potensi pasar melalui studi BEI dan NPS",
  "ringkasan_eksekutif": [
    "AHM MPX masih memimpin Brand Equity Index dengan skor 16,5, jauh di atas kompetitor lainnya [Studi BEI & NPS Motor Q1 2026, v1, hal. 31].",
    "Pertamina Enduro Series berada di peringkat ke-3 Brand Equity, turun dari peringkat ke-2 pada Q4 2025 [Studi BEI & NPS Motor Q1 2026, v1, hal. 31].",
    "Awareness Pertamina cukup kuat, tetapi konversi dari awareness ke consideration masih menjadi tantangan utama [Studi BEI & NPS Motor Q1 2026, v1, hal. 33].",
    "Kepuasan dan tingkat rekomendasi pengguna Enduro sangat tinggi, namun non-user masih menilai harga Enduro relatif mahal [Studi BEI & NPS Motor Q1 2026, v1, hal. 111]."
  ],
  "latar_belakang": "Industri pelumas di Indonesia terus berkembang seiring bertambahnya jumlah kendaraan bermotor dan kebutuhan akan pelumas berkualitas. Persaingan antara merek lokal dan internasional semakin ketat.\n\nStudi ini dilakukan untuk memahami posisi merek Pertamina Lubricants di pasar, perilaku konsumen, serta faktor-faktor yang memengaruhi keputusan pembelian.",
  "tujuan": [
    {"judul": "Mengukur Brand Equity dan Awareness", "uraian": "Mengukur tingkat brand awareness dan brand equity PTPL serta kompetitor untuk mengetahui posisi merek di pasar."},
    {"judul": "Memahami perilaku konsumen", "uraian": "Memahami perilaku penggunaan pelumas, faktor pembelian, dan peralihan antar merek."},
    {"judul": "Evaluasi Net Promoter Score", "uraian": "Mengukur pengalaman dan tingkat rekomendasi pelanggan terhadap produk PTPL dan kompetitor."},
    {"judul": "Evaluasi efektivitas kampanye", "uraian": "Menilai dampak kampanye, kerja sama, dan sponsorship terhadap awareness dan loyalitas."}
  ],
  "temuan_utama": [
    {
      "judul": "Brand Equity Index",
      "pesan_utama": "AHM MPX masih sangat dominan, sementara Pertamina Enduro Series berada di peringkat ke-3 dan turun dari Q4 2025.",
      "poin": [
        "AHM MPX memimpin dengan skor brand equity 16,5, hampir dua kali lipat merek di peringkat kedua.",
        "Pertamina Enduro Series, Pertamina Mesran, dan Pertamina Mesrania mengalami penurunan peringkat dari Q4 2025.",
        "Castrol Power 1 naik tajam dari peringkat ke-7 menjadi ke-2."
      ],
      "tabel": {
        "kolom": ["Merek", "Brand Equity", "Rank Q1 2026", "Rank Q4 2025"],
        "baris": [
          ["AHM MPX", "16,5", "1", "1"], ["Castrol Power 1", "8,5", "2", "7"],
          ["Pertamina Enduro Series", "6,7", "3", "2"], ["Castrol Activ", "6,7", "4", "8"],
          ["Shell Advance", "6,6", "5", "4"], ["AHM SPX", "6,1", "6", "9"],
          ["Federal Matic", "5,7", "7", "13"], ["Pertamina Mesran", "4,4", "8", "6"],
          ["Yamalube Matic", "4,3", "9", "5"], ["Federal Ultratec", "2,7", "10", "10"],
          ["Pertamina Mesrania", "1,3", "18", "16"]
        ]
      },
      "sitasi": ["[Studi BEI & NPS Motor Q1 2026, v1, hal. 31]"]
    },
    {
      "judul": "Brand Funnel by Brand",
      "pesan_utama": "Pertamina memiliki awareness yang kuat, tetapi masih sulit mengonversi awareness menjadi consideration.",
      "poin": [
        "AHM tetap menjadi merek dengan funnel terkuat dan loyalitas tertinggi.",
        "Castrol memimpin funnel dari sisi awareness dan consideration.",
        "Konversi Pertamina dari consideration ke penggunaan relatif terjaga."
      ],
      "sitasi": ["[Studi BEI & NPS Motor Q1 2026, v1, hal. 33]"]
    },
    {
      "judul": "Apa yang harus dilakukan Pertamina Enduro?",
      "pesan_utama": "Fokus perbaikan ada pada eksekusi di bengkel/ritel dan komunikasi kualitas.",
      "poin": [
        "Brand equity Enduro sudah cukup kuat (peringkat ke-3), tantangannya ada pada konversi awareness menjadi penggunaan.",
        "Brand image Enduro diasosiasikan dengan perusahaan terpercaya dan dukungan event balap motor.",
        "Out of stock saat momen pembelian menjadi hal utama yang harus diperbaiki.",
        "Rekomendasi mekanik di bengkel adalah sumber awareness dan pengaruh pembelian terkuat untuk Enduro."
      ],
      "sitasi": ["[Studi BEI & NPS Motor Q1 2026, v1, hal. 111]"]
    }
  ],
  "rekomendasi": [
    {"area": "Distribusi", "tindakan": "Perbaiki ketersediaan Enduro di bengkel dan toko untuk mengurangi out of stock saat momen pembelian.", "prioritas": "Tinggi", "alasan": "Out of stock adalah hambatan utama pembelian Enduro."},
    {"area": "Promosi", "tindakan": "Perkuat komunikasi value for money dan promosi yang lebih menarik untuk non-user.", "prioritas": "Tinggi", "alasan": "Non-user menilai harga Enduro relatif mahal."},
    {"area": "Bengkel", "tindakan": "Libatkan mekanik dan pemilik bengkel sebagai pemberi rekomendasi.", "prioritas": "Sedang", "alasan": "Rekomendasi mekanik adalah sumber pengaruh terkuat."}
  ],
  "keterbatasan": "Laporan ini hanya mencakup segmen Motor periode Q1 2026 berdasarkan dokumen yang dipilih pengguna. Angka dikutip langsung dari dokumen sumber tanpa analisis ulang.",
  "daftar_sumber": [
    {"judul_dokumen": "Studi BEI & NPS 2026 – Full Report Motor Q1 2026", "versi": "1"}
  ]
}
